No.     Time           Source                Destination           Protocol Length Info
      1 0.000000000    Giga-Byt_6d:4d:e6     Broadcast             ARP      60     Who has 10.10.10.99?  Tell 10.10.10.2

Frame 1: 60 bytes on wire (480 bits), 60 bytes captured (480 bits) on interface 0
Ethernet II, Src: Giga-Byt_6d:4d:e6 (90:2b:34:6d:4d:e6), Dst: Broadcast (ff:ff:ff:ff:ff:ff)
Address Resolution Protocol (request)

No.     Time           Source                Destination           Protocol Length Info
      2 0.000236000    Asiarock_15:3d:3a     Giga-Byt_6d:4d:e6     ARP      60     10.10.10.99 is at 00:19:66:15:3d:3a

Frame 2: 60 bytes on wire (480 bits), 60 bytes captured (480 bits) on interface 0
Ethernet II, Src: Asiarock_15:3d:3a (00:19:66:15:3d:3a), Dst: Giga-Byt_6d:4d:e6 (90:2b:34:6d:4d:e6)
Address Resolution Protocol (reply)

No.     Time           Source                Destination           Protocol Length Info
      3 0.000354000    10.10.10.2            10.10.10.99           TCP      74     42279→3128 [SYN] Seq=0 Win=14600 Len=0 MSS=1460 SACK_PERM=1 TSval=4641665 TSecr=0 WS=64

Frame 3: 74 bytes on wire (592 bits), 74 bytes captured (592 bits) on interface 0
Ethernet II, Src: Giga-Byt_6d:4d:e6 (90:2b:34:6d:4d:e6), Dst: Asiarock_15:3d:3a (00:19:66:15:3d:3a)
Internet Protocol Version 4, Src: 10.10.10.2 (10.10.10.2), Dst: 10.10.10.99 (10.10.10.99)
Transmission Control Protocol, Src Port: 42279 (42279), Dst Port: 3128 (3128), Seq: 0, Len: 0

No.     Time           Source                Destination           Protocol Length Info
      4 0.000471000    10.10.10.99           10.10.10.2            TCP      74     3128→42279 [SYN, ACK] Seq=0 Ack=1 Win=5792 Len=0 MSS=1460 SACK_PERM=1 TSval=1772124 TSecr=4641665 WS=32

Frame 4: 74 bytes on wire (592 bits), 74 bytes captured (592 bits) on interface 0
Ethernet II, Src: Asiarock_15:3d:3a (00:19:66:15:3d:3a), Dst: Giga-Byt_6d:4d:e6 (90:2b:34:6d:4d:e6)
Internet Protocol Version 4, Src: 10.10.10.99 (10.10.10.99), Dst: 10.10.10.2 (10.10.10.2)
Transmission Control Protocol, Src Port: 3128 (3128), Dst Port: 42279 (42279), Seq: 0, Ack: 1, Len: 0

No.     Time           Source                Destination           Protocol Length Info
      5 0.000668000    10.10.10.2            10.10.10.99           TCP      66     42279→3128 [ACK] Seq=1 Ack=1 Win=14656 Len=0 TSval=4641665 TSecr=1772124

Frame 5: 66 bytes on wire (528 bits), 66 bytes captured (528 bits) on interface 0
Ethernet II, Src: Giga-Byt_6d:4d:e6 (90:2b:34:6d:4d:e6), Dst: Asiarock_15:3d:3a (00:19:66:15:3d:3a)
Internet Protocol Version 4, Src: 10.10.10.2 (10.10.10.2), Dst: 10.10.10.99 (10.10.10.99)
Transmission Control Protocol, Src Port: 42279 (42279), Dst Port: 3128 (3128), Seq: 1, Ack: 1, Len: 0

No.     Time           Source                Destination           Protocol Length Info
      6 0.001266000    10.10.10.2            10.10.10.99           HTTP     416    GET http://www.orgx.com/123105.html HTTP/1.1 

Frame 6: 416 bytes on wire (3328 bits), 416 bytes captured (3328 bits) on interface 0
Ethernet II, Src: Giga-Byt_6d:4d:e6 (90:2b:34:6d:4d:e6), Dst: Asiarock_15:3d:3a (00:19:66:15:3d:3a)
Internet Protocol Version 4, Src: 10.10.10.2 (10.10.10.2), Dst: 10.10.10.99 (10.10.10.99)
Transmission Control Protocol, Src Port: 42279 (42279), Dst Port: 3128 (3128), Seq: 1, Ack: 1, Len: 350
Hypertext Transfer Protocol

No.     Time           Source                Destination           Protocol Length Info
      7 0.001275000    10.10.10.99           10.10.10.2            TCP      66     3128→42279 [ACK] Seq=1 Ack=351 Win=6880 Len=0 TSval=1772124 TSecr=4641665

Frame 7: 66 bytes on wire (528 bits), 66 bytes captured (528 bits) on interface 0
Ethernet II, Src: Asiarock_15:3d:3a (00:19:66:15:3d:3a), Dst: Giga-Byt_6d:4d:e6 (90:2b:34:6d:4d:e6)
Internet Protocol Version 4, Src: 10.10.10.99 (10.10.10.99), Dst: 10.10.10.2 (10.10.10.2)
Transmission Control Protocol, Src Port: 3128 (3128), Dst Port: 42279 (42279), Seq: 1, Ack: 351, Len: 0

No.     Time           Source                Destination           Protocol Length Info
      8 0.001704000    Asiarock_15:3d:3a     Broadcast             ARP      60     Who has 10.10.10.100?  Tell 10.10.10.99

Frame 8: 60 bytes on wire (480 bits), 60 bytes captured (480 bits) on interface 0
Ethernet II, Src: Asiarock_15:3d:3a (00:19:66:15:3d:3a), Dst: Broadcast (ff:ff:ff:ff:ff:ff)
Address Resolution Protocol (request)

No.     Time           Source                Destination           Protocol Length Info
      9 0.001869000    AsustekC_c2:04:78     Asiarock_15:3d:3a     ARP      60     10.10.10.100 is at 00:26:18:c2:04:78

Frame 9: 60 bytes on wire (480 bits), 60 bytes captured (480 bits) on interface 0
Ethernet II, Src: AsustekC_c2:04:78 (00:26:18:c2:04:78), Dst: Asiarock_15:3d:3a (00:19:66:15:3d:3a)
Address Resolution Protocol (reply)

No.     Time           Source                Destination           Protocol Length Info
     10 0.001902000    10.10.10.99           200.28.0.89           TCP      74     36426→80 [SYN] Seq=0 Win=5840 Len=0 MSS=1460 SACK_PERM=1 TSval=1772124 TSecr=0 WS=32

Frame 10: 74 bytes on wire (592 bits), 74 bytes captured (592 bits) on interface 0
Ethernet II, Src: Asiarock_15:3d:3a (00:19:66:15:3d:3a), Dst: AsustekC_c2:04:78 (00:26:18:c2:04:78)
Internet Protocol Version 4, Src: 10.10.10.99 (10.10.10.99), Dst: 200.28.0.89 (200.28.0.89)
Transmission Control Protocol, Src Port: 36426 (36426), Dst Port: 80 (80), Seq: 0, Len: 0

No.     Time           Source                Destination           Protocol Length Info
     11 0.011023000    BrocadeC_c7:65:cc     Broadcast             ARP      60     Who has 210.200.12.65?  Tell 210.200.12.66

Frame 11: 60 bytes on wire (480 bits), 60 bytes captured (480 bits) on interface 0
Ethernet II, Src: BrocadeC_c7:65:cc (00:e0:52:c7:65:cc), Dst: Broadcast (ff:ff:ff:ff:ff:ff)
Address Resolution Protocol (request)

No.     Time           Source                Destination           Protocol Length Info
     12 0.011051000    Netronix_f2:93:1a     BrocadeC_c7:65:cc     ARP      60     210.200.12.65 is at 00:e0:7d:f2:93:1a

Frame 12: 60 bytes on wire (480 bits), 60 bytes captured (480 bits) on interface 0
Ethernet II, Src: Netronix_f2:93:1a (00:e0:7d:f2:93:1a), Dst: BrocadeC_c7:65:cc (00:e0:52:c7:65:cc)
Address Resolution Protocol (reply)

No.     Time           Source                Destination           Protocol Length Info
     13 0.011148000    210.200.12.66         200.28.0.89           TCP      74     36426→80 [SYN] Seq=0 Win=5840 Len=0 MSS=1460 SACK_PERM=1 TSval=1772124 TSecr=0 WS=32

Frame 13: 74 bytes on wire (592 bits), 74 bytes captured (592 bits) on interface 0
Ethernet II, Src: BrocadeC_c7:65:cc (00:e0:52:c7:65:cc), Dst: Netronix_f2:93:1a (00:e0:7d:f2:93:1a)
Internet Protocol Version 4, Src: 210.200.12.66 (210.200.12.66), Dst: 200.28.0.89 (200.28.0.89)
Transmission Control Protocol, Src Port: 36426 (36426), Dst Port: 80 (80), Seq: 0, Len: 0

No.     Time           Source                Destination           Protocol Length Info
     14 0.011238000    Netronix_f2:93:1a     Broadcast             ARP      60     Who has 147.12.3.1?  Tell 147.12.3.2

Frame 14: 60 bytes on wire (480 bits), 60 bytes captured (480 bits) on interface 0
Ethernet II, Src: Netronix_f2:93:1a (00:e0:7d:f2:93:1a), Dst: Broadcast (ff:ff:ff:ff:ff:ff)
Address Resolution Protocol (request)

No.     Time           Source                Destination           Protocol Length Info
     15 0.011410000    Netronix_4a:14:20     Netronix_f2:93:1a     ARP      60     147.12.3.1 is at 00:08:54:4a:14:20

Frame 15: 60 bytes on wire (480 bits), 60 bytes captured (480 bits) on interface 0
Ethernet II, Src: Netronix_4a:14:20 (00:08:54:4a:14:20), Dst: Netronix_f2:93:1a (00:e0:7d:f2:93:1a)
Address Resolution Protocol (reply)

No.     Time           Source                Destination           Protocol Length Info
     16 0.011421000    210.200.12.66         200.28.0.89           TCP      74     [TCP Out-Of-Order] 36426→80 [SYN] Seq=0 Win=5840 Len=0 MSS=1460 SACK_PERM=1 TSval=1772124 TSecr=0 WS=32

Frame 16: 74 bytes on wire (592 bits), 74 bytes captured (592 bits) on interface 0
Ethernet II, Src: Netronix_f2:93:1a (00:e0:7d:f2:93:1a), Dst: Netronix_4a:14:20 (00:08:54:4a:14:20)
Internet Protocol Version 4, Src: 210.200.12.66 (210.200.12.66), Dst: 200.28.0.89 (200.28.0.89)
Transmission Control Protocol, Src Port: 36426 (36426), Dst Port: 80 (80), Seq: 0, Len: 0

No.     Time           Source                Destination           Protocol Length Info
     17 0.011532000    Asiarock_15:3d:1d     Broadcast             ARP      60     Who has 200.28.0.89?  Tell 200.28.0.100

Frame 17: 60 bytes on wire (480 bits), 60 bytes captured (480 bits) on interface 0
Ethernet II, Src: Asiarock_15:3d:1d (00:19:66:15:3d:1d), Dst: Broadcast (ff:ff:ff:ff:ff:ff)
Address Resolution Protocol (request)

No.     Time           Source                Destination           Protocol Length Info
     18 0.011632000    00.00.00              00.00.00              FC       60     Unknown frame[Malformed Packet]

Frame 18: 60 bytes on wire (480 bits), 60 bytes captured (480 bits) on interface 0
Ethernet II, Src: 00:00:00_00:00:00 (00:00:00:00:00:00), Dst: 00:00:00_00:00:00 (00:00:00:00:00:00)
MDS Header(Unknown(0)/Unknown(11))
Fibre Channel
[Malformed Packet: FC]

No.     Time           Source                Destination           Protocol Length Info
     19 1.008840000    Asiarock_15:3d:1d     Broadcast             ARP      60     Who has 200.28.0.89?  Tell 200.28.0.100

Frame 19: 60 bytes on wire (480 bits), 60 bytes captured (480 bits) on interface 0
Ethernet II, Src: Asiarock_15:3d:1d (00:19:66:15:3d:1d), Dst: Broadcast (ff:ff:ff:ff:ff:ff)
Address Resolution Protocol (request)

No.     Time           Source                Destination           Protocol Length Info
     20 1.008930000    Giga-Byt_8d:35:c5     Asiarock_15:3d:1d     ARP      60     200.28.0.89 is at 90:2b:34:8d:35:c5

Frame 20: 60 bytes on wire (480 bits), 60 bytes captured (480 bits) on interface 0
Ethernet II, Src: Giga-Byt_8d:35:c5 (90:2b:34:8d:35:c5), Dst: Asiarock_15:3d:1d (00:19:66:15:3d:1d)
Address Resolution Protocol (reply)

No.     Time           Source                Destination           Protocol Length Info
     21 1.009039000    210.200.12.66         200.28.0.89           TCP      74     [TCP Retransmission] 36426→80 [SYN] Seq=0 Win=5840 Len=0 MSS=1460 SACK_PERM=1 TSval=1772124 TSecr=0 WS=32

Frame 21: 74 bytes on wire (592 bits), 74 bytes captured (592 bits) on interface 0
Ethernet II, Src: Asiarock_15:3d:1d (00:19:66:15:3d:1d), Dst: Giga-Byt_8d:35:c5 (90:2b:34:8d:35:c5)
Internet Protocol Version 4, Src: 210.200.12.66 (210.200.12.66), Dst: 200.28.0.89 (200.28.0.89)
Transmission Control Protocol, Src Port: 36426 (36426), Dst Port: 80 (80), Seq: 0, Len: 0

No.     Time           Source                Destination           Protocol Length Info
     22 1.009154000    200.28.0.89           210.200.12.66         TCP      74     80→36426 [SYN, ACK] Seq=0 Ack=1 Win=14480 Len=0 MSS=1460 SACK_PERM=1 TSval=4933852 TSecr=1772124 WS=64

Frame 22: 74 bytes on wire (592 bits), 74 bytes captured (592 bits) on interface 0
Ethernet II, Src: Giga-Byt_8d:35:c5 (90:2b:34:8d:35:c5), Dst: Asiarock_15:3d:1d (00:19:66:15:3d:1d)
Internet Protocol Version 4, Src: 200.28.0.89 (200.28.0.89), Dst: 210.200.12.66 (210.200.12.66)
Transmission Control Protocol, Src Port: 80 (80), Dst Port: 36426 (36426), Seq: 0, Ack: 1, Len: 0

No.     Time           Source                Destination           Protocol Length Info
     23 1.009345000    200.28.0.89           210.200.12.66         TCP      74     [TCP Out-Of-Order] 80→36426 [SYN, ACK] Seq=0 Ack=1 Win=14480 Len=0 MSS=1460 SACK_PERM=1 TSval=4933852 TSecr=1772124 WS=64

Frame 23: 74 bytes on wire (592 bits), 74 bytes captured (592 bits) on interface 0
Ethernet II, Src: Netronix_4a:14:20 (00:08:54:4a:14:20), Dst: BrocadeC_c7:65:cc (00:e0:52:c7:65:cc)
Internet Protocol Version 4, Src: 200.28.0.89 (200.28.0.89), Dst: 210.200.12.66 (210.200.12.66)
Transmission Control Protocol, Src Port: 80 (80), Dst Port: 36426 (36426), Seq: 0, Ack: 1, Len: 0

No.     Time           Source                Destination           Protocol Length Info
     24 1.009355000    200.28.0.89           10.10.10.99           TCP      74     80→36426 [SYN, ACK] Seq=0 Ack=1 Win=14480 Len=0 MSS=1460 SACK_PERM=1 TSval=4933852 TSecr=1772124 WS=64

Frame 24: 74 bytes on wire (592 bits), 74 bytes captured (592 bits) on interface 0
Ethernet II, Src: AsustekC_c2:04:78 (00:26:18:c2:04:78), Dst: Asiarock_15:3d:3a (00:19:66:15:3d:3a)
Internet Protocol Version 4, Src: 200.28.0.89 (200.28.0.89), Dst: 10.10.10.99 (10.10.10.99)
Transmission Control Protocol, Src Port: 80 (80), Dst Port: 36426 (36426), Seq: 0, Ack: 1, Len: 0

No.     Time           Source                Destination           Protocol Length Info
     25 1.009481000    10.10.10.99           200.28.0.89           TCP      66     36426→80 [ACK] Seq=1 Ack=1 Win=5856 Len=0 TSval=1772376 TSecr=4933852

Frame 25: 66 bytes on wire (528 bits), 66 bytes captured (528 bits) on interface 0
Ethernet II, Src: Asiarock_15:3d:3a (00:19:66:15:3d:3a), Dst: AsustekC_c2:04:78 (00:26:18:c2:04:78)
Internet Protocol Version 4, Src: 10.10.10.99 (10.10.10.99), Dst: 200.28.0.89 (200.28.0.89)
Transmission Control Protocol, Src Port: 36426 (36426), Dst Port: 80 (80), Seq: 1, Ack: 1, Len: 0

No.     Time           Source                Destination           Protocol Length Info
     26 1.009576000    210.200.12.66         200.28.0.89           TCP      66     36426→80 [ACK] Seq=1 Ack=1 Win=5856 Len=0 TSval=1772376 TSecr=4933852

Frame 26: 66 bytes on wire (528 bits), 66 bytes captured (528 bits) on interface 0
Ethernet II, Src: BrocadeC_c7:65:cc (00:e0:52:c7:65:cc), Dst: Netronix_f2:93:1a (00:e0:7d:f2:93:1a)
Internet Protocol Version 4, Src: 210.200.12.66 (210.200.12.66), Dst: 200.28.0.89 (200.28.0.89)
Transmission Control Protocol, Src Port: 36426 (36426), Dst Port: 80 (80), Seq: 1, Ack: 1, Len: 0

No.     Time           Source                Destination           Protocol Length Info
     27 1.010107000    10.10.10.99           200.28.0.89           HTTP     499    GET /123105.html HTTP/1.0 

Frame 27: 499 bytes on wire (3992 bits), 499 bytes captured (3992 bits) on interface 0
Ethernet II, Src: Asiarock_15:3d:3a (00:19:66:15:3d:3a), Dst: AsustekC_c2:04:78 (00:26:18:c2:04:78)
Internet Protocol Version 4, Src: 10.10.10.99 (10.10.10.99), Dst: 200.28.0.89 (200.28.0.89)
Transmission Control Protocol, Src Port: 36426 (36426), Dst Port: 80 (80), Seq: 1, Ack: 1, Len: 433
Hypertext Transfer Protocol

No.     Time           Source                Destination           Protocol Length Info
     28 1.010112000    210.200.12.66         200.28.0.89           TCP      66     [TCP Dup ACK 26#1] 36426→80 [ACK] Seq=1 Ack=1 Win=5856 Len=0 TSval=1772376 TSecr=4933852

Frame 28: 66 bytes on wire (528 bits), 66 bytes captured (528 bits) on interface 0
Ethernet II, Src: Netronix_f2:93:1a (00:e0:7d:f2:93:1a), Dst: Netronix_4a:14:20 (00:08:54:4a:14:20)
Internet Protocol Version 4, Src: 210.200.12.66 (210.200.12.66), Dst: 200.28.0.89 (200.28.0.89)
Transmission Control Protocol, Src Port: 36426 (36426), Dst Port: 80 (80), Seq: 1, Ack: 1, Len: 0

No.     Time           Source                Destination           Protocol Length Info
     29 1.010572000    210.200.12.66         200.28.0.89           HTTP     499    GET /123105.html HTTP/1.0 

Frame 29: 499 bytes on wire (3992 bits), 499 bytes captured (3992 bits) on interface 0
Ethernet II, Src: BrocadeC_c7:65:cc (00:e0:52:c7:65:cc), Dst: Netronix_f2:93:1a (00:e0:7d:f2:93:1a)
Internet Protocol Version 4, Src: 210.200.12.66 (210.200.12.66), Dst: 200.28.0.89 (200.28.0.89)
Transmission Control Protocol, Src Port: 36426 (36426), Dst Port: 80 (80), Seq: 1, Ack: 1, Len: 433
Hypertext Transfer Protocol

No.     Time           Source                Destination           Protocol Length Info
     30 1.010574000    210.200.12.66         200.28.0.89           TCP      66     36426→80 [ACK] Seq=1 Ack=1 Win=5856 Len=0 TSval=1772376 TSecr=4933852

Frame 30: 66 bytes on wire (528 bits), 66 bytes captured (528 bits) on interface 0
Ethernet II, Src: Asiarock_15:3d:1d (00:19:66:15:3d:1d), Dst: Giga-Byt_8d:35:c5 (90:2b:34:8d:35:c5)
Internet Protocol Version 4, Src: 210.200.12.66 (210.200.12.66), Dst: 200.28.0.89 (200.28.0.89)
Transmission Control Protocol, Src Port: 36426 (36426), Dst Port: 80 (80), Seq: 1, Ack: 1, Len: 0

No.     Time           Source                Destination           Protocol Length Info
     31 1.012296000    210.200.12.66         200.28.0.89           HTTP     499    [TCP Retransmission] GET /123105.html HTTP/1.0 

Frame 31: 499 bytes on wire (3992 bits), 499 bytes captured (3992 bits) on interface 0
Ethernet II, Src: Netronix_f2:93:1a (00:e0:7d:f2:93:1a), Dst: Netronix_4a:14:20 (00:08:54:4a:14:20)
Internet Protocol Version 4, Src: 210.200.12.66 (210.200.12.66), Dst: 200.28.0.89 (200.28.0.89)
Transmission Control Protocol, Src Port: 36426 (36426), Dst Port: 80 (80), Seq: 1, Ack: 1, Len: 433
Hypertext Transfer Protocol

No.     Time           Source                Destination           Protocol Length Info
     32 1.012299000    210.200.12.66         200.28.0.89           HTTP     499    [TCP Retransmission] GET /123105.html HTTP/1.0 

Frame 32: 499 bytes on wire (3992 bits), 499 bytes captured (3992 bits) on interface 0
Ethernet II, Src: Asiarock_15:3d:1d (00:19:66:15:3d:1d), Dst: Giga-Byt_8d:35:c5 (90:2b:34:8d:35:c5)
Internet Protocol Version 4, Src: 210.200.12.66 (210.200.12.66), Dst: 200.28.0.89 (200.28.0.89)
Transmission Control Protocol, Src Port: 36426 (36426), Dst Port: 80 (80), Seq: 1, Ack: 1, Len: 433
Hypertext Transfer Protocol

No.     Time           Source                Destination           Protocol Length Info
     33 1.012811000    200.28.0.89           210.200.12.66         TCP      66     80→36426 [ACK] Seq=1 Ack=434 Win=15552 Len=0 TSval=4933853 TSecr=1772376

Frame 33: 66 bytes on wire (528 bits), 66 bytes captured (528 bits) on interface 0
Ethernet II, Src: Giga-Byt_8d:35:c5 (90:2b:34:8d:35:c5), Dst: Asiarock_15:3d:1d (00:19:66:15:3d:1d)
Internet Protocol Version 4, Src: 200.28.0.89 (200.28.0.89), Dst: 210.200.12.66 (210.200.12.66)
Transmission Control Protocol, Src Port: 80 (80), Dst Port: 36426 (36426), Seq: 1, Ack: 434, Len: 0

No.     Time           Source                Destination           Protocol Length Info
     34 1.012820000    200.28.0.89           210.200.12.66         TCP      66     [TCP Dup ACK 33#1] 80→36426 [ACK] Seq=1 Ack=434 Win=15552 Len=0 TSval=4933853 TSecr=1772376

Frame 34: 66 bytes on wire (528 bits), 66 bytes captured (528 bits) on interface 0
Ethernet II, Src: Netronix_4a:14:20 (00:08:54:4a:14:20), Dst: BrocadeC_c7:65:cc (00:e0:52:c7:65:cc)
Internet Protocol Version 4, Src: 200.28.0.89 (200.28.0.89), Dst: 210.200.12.66 (210.200.12.66)
Transmission Control Protocol, Src Port: 80 (80), Dst Port: 36426 (36426), Seq: 1, Ack: 434, Len: 0

No.     Time           Source                Destination           Protocol Length Info
     35 1.012905000    200.28.0.89           10.10.10.99           TCP      66     80→36426 [ACK] Seq=1 Ack=434 Win=15552 Len=0 TSval=4933853 TSecr=1772376

Frame 35: 66 bytes on wire (528 bits), 66 bytes captured (528 bits) on interface 0
Ethernet II, Src: AsustekC_c2:04:78 (00:26:18:c2:04:78), Dst: Asiarock_15:3d:3a (00:19:66:15:3d:3a)
Internet Protocol Version 4, Src: 200.28.0.89 (200.28.0.89), Dst: 10.10.10.99 (10.10.10.99)
Transmission Control Protocol, Src Port: 80 (80), Dst Port: 36426 (36426), Seq: 1, Ack: 434, Len: 0

No.     Time           Source                Destination           Protocol Length Info
     36 1.015516000    200.28.0.89           210.200.12.66         HTTP     958    HTTP/1.1 200 OK  (text/html)

Frame 36: 958 bytes on wire (7664 bits), 958 bytes captured (7664 bits) on interface 0
Ethernet II, Src: Giga-Byt_8d:35:c5 (90:2b:34:8d:35:c5), Dst: Asiarock_15:3d:1d (00:19:66:15:3d:1d)
Internet Protocol Version 4, Src: 200.28.0.89 (200.28.0.89), Dst: 210.200.12.66 (210.200.12.66)
Transmission Control Protocol, Src Port: 80 (80), Dst Port: 36426 (36426), Seq: 1, Ack: 434, Len: 892
Hypertext Transfer Protocol
Line-based text data: text/html

No.     Time           Source                Destination           Protocol Length Info
     37 1.015527000    200.28.0.89           210.200.12.66         HTTP     958    [TCP Retransmission] HTTP/1.1 200 OK  (text/html)

Frame 37: 958 bytes on wire (7664 bits), 958 bytes captured (7664 bits) on interface 0
Ethernet II, Src: Netronix_4a:14:20 (00:08:54:4a:14:20), Dst: BrocadeC_c7:65:cc (00:e0:52:c7:65:cc)
Internet Protocol Version 4, Src: 200.28.0.89 (200.28.0.89), Dst: 210.200.12.66 (210.200.12.66)
Transmission Control Protocol, Src Port: 80 (80), Dst Port: 36426 (36426), Seq: 1, Ack: 434, Len: 892
Hypertext Transfer Protocol
Line-based text data: text/html

No.     Time           Source                Destination           Protocol Length Info
     38 1.016021000    200.28.0.89           10.10.10.99           HTTP     958    HTTP/1.1 200 OK  (text/html)

Frame 38: 958 bytes on wire (7664 bits), 958 bytes captured (7664 bits) on interface 0
Ethernet II, Src: AsustekC_c2:04:78 (00:26:18:c2:04:78), Dst: Asiarock_15:3d:3a (00:19:66:15:3d:3a)
Internet Protocol Version 4, Src: 200.28.0.89 (200.28.0.89), Dst: 10.10.10.99 (10.10.10.99)
Transmission Control Protocol, Src Port: 80 (80), Dst Port: 36426 (36426), Seq: 1, Ack: 434, Len: 892
Hypertext Transfer Protocol
Line-based text data: text/html

No.     Time           Source                Destination           Protocol Length Info
     39 1.016023000    10.10.10.99           200.28.0.89           TCP      66     36426→80 [ACK] Seq=434 Ack=893 Win=7648 Len=0 TSval=1772378 TSecr=4933853

Frame 39: 66 bytes on wire (528 bits), 66 bytes captured (528 bits) on interface 0
Ethernet II, Src: Asiarock_15:3d:3a (00:19:66:15:3d:3a), Dst: AsustekC_c2:04:78 (00:26:18:c2:04:78)
Internet Protocol Version 4, Src: 10.10.10.99 (10.10.10.99), Dst: 200.28.0.89 (200.28.0.89)
Transmission Control Protocol, Src Port: 36426 (36426), Dst Port: 80 (80), Seq: 434, Ack: 893, Len: 0

No.     Time           Source                Destination           Protocol Length Info
     40 1.016114000    210.200.12.66         200.28.0.89           TCP      66     36426→80 [ACK] Seq=434 Ack=893 Win=7648 Len=0 TSval=1772378 TSecr=4933853

Frame 40: 66 bytes on wire (528 bits), 66 bytes captured (528 bits) on interface 0
Ethernet II, Src: BrocadeC_c7:65:cc (00:e0:52:c7:65:cc), Dst: Netronix_f2:93:1a (00:e0:7d:f2:93:1a)
Internet Protocol Version 4, Src: 210.200.12.66 (210.200.12.66), Dst: 200.28.0.89 (200.28.0.89)
Transmission Control Protocol, Src Port: 36426 (36426), Dst Port: 80 (80), Seq: 434, Ack: 893, Len: 0

No.     Time           Source                Destination           Protocol Length Info
     41 1.016198000    210.200.12.66         200.28.0.89           TCP      66     [TCP Dup ACK 40#1] 36426→80 [ACK] Seq=434 Ack=893 Win=7648 Len=0 TSval=1772378 TSecr=4933853

Frame 41: 66 bytes on wire (528 bits), 66 bytes captured (528 bits) on interface 0
Ethernet II, Src: Netronix_f2:93:1a (00:e0:7d:f2:93:1a), Dst: Netronix_4a:14:20 (00:08:54:4a:14:20)
Internet Protocol Version 4, Src: 210.200.12.66 (210.200.12.66), Dst: 200.28.0.89 (200.28.0.89)
Transmission Control Protocol, Src Port: 36426 (36426), Dst Port: 80 (80), Seq: 434, Ack: 893, Len: 0

No.     Time           Source                Destination           Protocol Length Info
     42 1.016292000    210.200.12.66         200.28.0.89           TCP      66     [TCP Dup ACK 40#2] 36426→80 [ACK] Seq=434 Ack=893 Win=7648 Len=0 TSval=1772378 TSecr=4933853

Frame 42: 66 bytes on wire (528 bits), 66 bytes captured (528 bits) on interface 0
Ethernet II, Src: Asiarock_15:3d:1d (00:19:66:15:3d:1d), Dst: Giga-Byt_8d:35:c5 (90:2b:34:8d:35:c5)
Internet Protocol Version 4, Src: 210.200.12.66 (210.200.12.66), Dst: 200.28.0.89 (200.28.0.89)
Transmission Control Protocol, Src Port: 36426 (36426), Dst Port: 80 (80), Seq: 434, Ack: 893, Len: 0

No.     Time           Source                Destination           Protocol Length Info
     43 1.018135000    10.10.10.99           10.10.10.2            TCP      511    [TCP segment of a reassembled PDU]

Frame 43: 511 bytes on wire (4088 bits), 511 bytes captured (4088 bits) on interface 0
Ethernet II, Src: Asiarock_15:3d:3a (00:19:66:15:3d:3a), Dst: Giga-Byt_6d:4d:e6 (90:2b:34:6d:4d:e6)
Internet Protocol Version 4, Src: 10.10.10.99 (10.10.10.99), Dst: 10.10.10.2 (10.10.10.2)
Transmission Control Protocol, Src Port: 3128 (3128), Dst Port: 42279 (42279), Seq: 1, Ack: 351, Len: 445

No.     Time           Source                Destination           Protocol Length Info
     44 1.018146000    10.10.10.99           10.10.10.2            HTTP     619    HTTP/1.0 200 OK  (text/html)

Frame 44: 619 bytes on wire (4952 bits), 619 bytes captured (4952 bits) on interface 0
Ethernet II, Src: Asiarock_15:3d:3a (00:19:66:15:3d:3a), Dst: Giga-Byt_6d:4d:e6 (90:2b:34:6d:4d:e6)
Internet Protocol Version 4, Src: 10.10.10.99 (10.10.10.99), Dst: 10.10.10.2 (10.10.10.2)
Transmission Control Protocol, Src Port: 3128 (3128), Dst Port: 42279 (42279), Seq: 446, Ack: 351, Len: 553
[2 Reassembled TCP Segments (998 bytes): #43(445), #44(553)]
Hypertext Transfer Protocol
Line-based text data: text/html

No.     Time           Source                Destination           Protocol Length Info
     45 1.018301000    10.10.10.2            10.10.10.99           TCP      66     42279→3128 [ACK] Seq=351 Ack=446 Win=15680 Len=0 TSval=4641920 TSecr=1772378

Frame 45: 66 bytes on wire (528 bits), 66 bytes captured (528 bits) on interface 0
Ethernet II, Src: Giga-Byt_6d:4d:e6 (90:2b:34:6d:4d:e6), Dst: Asiarock_15:3d:3a (00:19:66:15:3d:3a)
Internet Protocol Version 4, Src: 10.10.10.2 (10.10.10.2), Dst: 10.10.10.99 (10.10.10.99)
Transmission Control Protocol, Src Port: 42279 (42279), Dst Port: 3128 (3128), Seq: 351, Ack: 446, Len: 0

No.     Time           Source                Destination           Protocol Length Info
     46 1.018442000    10.10.10.2            10.10.10.99           TCP      66     42279→3128 [ACK] Seq=351 Ack=999 Win=16832 Len=0 TSval=4641920 TSecr=1772378

Frame 46: 66 bytes on wire (528 bits), 66 bytes captured (528 bits) on interface 0
Ethernet II, Src: Giga-Byt_6d:4d:e6 (90:2b:34:6d:4d:e6), Dst: Asiarock_15:3d:3a (00:19:66:15:3d:3a)
Internet Protocol Version 4, Src: 10.10.10.2 (10.10.10.2), Dst: 10.10.10.99 (10.10.10.99)
Transmission Control Protocol, Src Port: 42279 (42279), Dst Port: 3128 (3128), Seq: 351, Ack: 999, Len: 0

No.     Time           Source                Destination           Protocol Length Info
     47 1.160122000    10.10.10.2            10.10.10.99           TCP      74     42280→3128 [SYN] Seq=0 Win=14600 Len=0 MSS=1460 SACK_PERM=1 TSval=4641955 TSecr=0 WS=64

Frame 47: 74 bytes on wire (592 bits), 74 bytes captured (592 bits) on interface 0
Ethernet II, Src: Giga-Byt_6d:4d:e6 (90:2b:34:6d:4d:e6), Dst: Asiarock_15:3d:3a (00:19:66:15:3d:3a)
Internet Protocol Version 4, Src: 10.10.10.2 (10.10.10.2), Dst: 10.10.10.99 (10.10.10.99)
Transmission Control Protocol, Src Port: 42280 (42280), Dst Port: 3128 (3128), Seq: 0, Len: 0

No.     Time           Source                Destination           Protocol Length Info
     48 1.160131000    10.10.10.2            10.10.10.99           TCP      74     42281→3128 [SYN] Seq=0 Win=14600 Len=0 MSS=1460 SACK_PERM=1 TSval=4641955 TSecr=0 WS=64

Frame 48: 74 bytes on wire (592 bits), 74 bytes captured (592 bits) on interface 0
Ethernet II, Src: Giga-Byt_6d:4d:e6 (90:2b:34:6d:4d:e6), Dst: Asiarock_15:3d:3a (00:19:66:15:3d:3a)
Internet Protocol Version 4, Src: 10.10.10.2 (10.10.10.2), Dst: 10.10.10.99 (10.10.10.99)
Transmission Control Protocol, Src Port: 42281 (42281), Dst Port: 3128 (3128), Seq: 0, Len: 0

No.     Time           Source                Destination           Protocol Length Info
     49 1.160282000    10.10.10.99           10.10.10.2            TCP      74     3128→42280 [SYN, ACK] Seq=0 Ack=1 Win=5792 Len=0 MSS=1460 SACK_PERM=1 TSval=1772414 TSecr=4641955 WS=32

Frame 49: 74 bytes on wire (592 bits), 74 bytes captured (592 bits) on interface 0
Ethernet II, Src: Asiarock_15:3d:3a (00:19:66:15:3d:3a), Dst: Giga-Byt_6d:4d:e6 (90:2b:34:6d:4d:e6)
Internet Protocol Version 4, Src: 10.10.10.99 (10.10.10.99), Dst: 10.10.10.2 (10.10.10.2)
Transmission Control Protocol, Src Port: 3128 (3128), Dst Port: 42280 (42280), Seq: 0, Ack: 1, Len: 0

No.     Time           Source                Destination           Protocol Length Info
     50 1.160291000    10.10.10.99           10.10.10.2            TCP      74     3128→42281 [SYN, ACK] Seq=0 Ack=1 Win=5792 Len=0 MSS=1460 SACK_PERM=1 TSval=1772414 TSecr=4641955 WS=32

Frame 50: 74 bytes on wire (592 bits), 74 bytes captured (592 bits) on interface 0
Ethernet II, Src: Asiarock_15:3d:3a (00:19:66:15:3d:3a), Dst: Giga-Byt_6d:4d:e6 (90:2b:34:6d:4d:e6)
Internet Protocol Version 4, Src: 10.10.10.99 (10.10.10.99), Dst: 10.10.10.2 (10.10.10.2)
Transmission Control Protocol, Src Port: 3128 (3128), Dst Port: 42281 (42281), Seq: 0, Ack: 1, Len: 0

No.     Time           Source                Destination           Protocol Length Info
     51 1.160370000    10.10.10.2            10.10.10.99           TCP      66     42280→3128 [ACK] Seq=1 Ack=1 Win=14656 Len=0 TSval=4641955 TSecr=1772414

Frame 51: 66 bytes on wire (528 bits), 66 bytes captured (528 bits) on interface 0
Ethernet II, Src: Giga-Byt_6d:4d:e6 (90:2b:34:6d:4d:e6), Dst: Asiarock_15:3d:3a (00:19:66:15:3d:3a)
Internet Protocol Version 4, Src: 10.10.10.2 (10.10.10.2), Dst: 10.10.10.99 (10.10.10.99)
Transmission Control Protocol, Src Port: 42280 (42280), Dst Port: 3128 (3128), Seq: 1, Ack: 1, Len: 0

No.     Time           Source                Destination           Protocol Length Info
     52 1.160439000    10.10.10.2            10.10.10.99           TCP      66     42281→3128 [ACK] Seq=1 Ack=1 Win=14656 Len=0 TSval=4641955 TSecr=1772414

Frame 52: 66 bytes on wire (528 bits), 66 bytes captured (528 bits) on interface 0
Ethernet II, Src: Giga-Byt_6d:4d:e6 (90:2b:34:6d:4d:e6), Dst: Asiarock_15:3d:3a (00:19:66:15:3d:3a)
Internet Protocol Version 4, Src: 10.10.10.2 (10.10.10.2), Dst: 10.10.10.99 (10.10.10.99)
Transmission Control Protocol, Src Port: 42281 (42281), Dst Port: 3128 (3128), Seq: 1, Ack: 1, Len: 0

No.     Time           Source                Destination           Protocol Length Info
     53 1.161090000    10.10.10.2            10.10.10.99           HTTP     276    CONNECT img.orgx.com:443 HTTP/1.1 

Frame 53: 276 bytes on wire (2208 bits), 276 bytes captured (2208 bits) on interface 0
Ethernet II, Src: Giga-Byt_6d:4d:e6 (90:2b:34:6d:4d:e6), Dst: Asiarock_15:3d:3a (00:19:66:15:3d:3a)
Internet Protocol Version 4, Src: 10.10.10.2 (10.10.10.2), Dst: 10.10.10.99 (10.10.10.99)
Transmission Control Protocol, Src Port: 42280 (42280), Dst Port: 3128 (3128), Seq: 1, Ack: 1, Len: 210
Hypertext Transfer Protocol

No.     Time           Source                Destination           Protocol Length Info
     54 1.161099000    10.10.10.2            10.10.10.99           HTTP     276    CONNECT img.orgx.com:443 HTTP/1.1 

Frame 54: 276 bytes on wire (2208 bits), 276 bytes captured (2208 bits) on interface 0
Ethernet II, Src: Giga-Byt_6d:4d:e6 (90:2b:34:6d:4d:e6), Dst: Asiarock_15:3d:3a (00:19:66:15:3d:3a)
Internet Protocol Version 4, Src: 10.10.10.2 (10.10.10.2), Dst: 10.10.10.99 (10.10.10.99)
Transmission Control Protocol, Src Port: 42281 (42281), Dst Port: 3128 (3128), Seq: 1, Ack: 1, Len: 210
Hypertext Transfer Protocol

No.     Time           Source                Destination           Protocol Length Info
     55 1.161101000    10.10.10.99           10.10.10.2            TCP      66     3128→42280 [ACK] Seq=1 Ack=211 Win=6880 Len=0 TSval=1772414 TSecr=4641955

Frame 55: 66 bytes on wire (528 bits), 66 bytes captured (528 bits) on interface 0
Ethernet II, Src: Asiarock_15:3d:3a (00:19:66:15:3d:3a), Dst: Giga-Byt_6d:4d:e6 (90:2b:34:6d:4d:e6)
Internet Protocol Version 4, Src: 10.10.10.99 (10.10.10.99), Dst: 10.10.10.2 (10.10.10.2)
Transmission Control Protocol, Src Port: 3128 (3128), Dst Port: 42280 (42280), Seq: 1, Ack: 211, Len: 0

No.     Time           Source                Destination           Protocol Length Info
     56 1.161103000    10.10.10.99           200.28.0.90           TCP      74     52186→443 [SYN] Seq=0 Win=5840 Len=0 MSS=1460 SACK_PERM=1 TSval=1772414 TSecr=0 WS=32

Frame 56: 74 bytes on wire (592 bits), 74 bytes captured (592 bits) on interface 0
Ethernet II, Src: Asiarock_15:3d:3a (00:19:66:15:3d:3a), Dst: AsustekC_c2:04:78 (00:26:18:c2:04:78)
Internet Protocol Version 4, Src: 10.10.10.99 (10.10.10.99), Dst: 200.28.0.90 (200.28.0.90)
Transmission Control Protocol, Src Port: 52186 (52186), Dst Port: 443 (443), Seq: 0, Len: 0

No.     Time           Source                Destination           Protocol Length Info
     57 1.161174000    10.10.10.99           10.10.10.2            TCP      66     3128→42281 [ACK] Seq=1 Ack=211 Win=6880 Len=0 TSval=1772414 TSecr=4641955

Frame 57: 66 bytes on wire (528 bits), 66 bytes captured (528 bits) on interface 0
Ethernet II, Src: Asiarock_15:3d:3a (00:19:66:15:3d:3a), Dst: Giga-Byt_6d:4d:e6 (90:2b:34:6d:4d:e6)
Internet Protocol Version 4, Src: 10.10.10.99 (10.10.10.99), Dst: 10.10.10.2 (10.10.10.2)
Transmission Control Protocol, Src Port: 3128 (3128), Dst Port: 42281 (42281), Seq: 1, Ack: 211, Len: 0

No.     Time           Source                Destination           Protocol Length Info
     58 1.161272000    210.200.12.66         200.28.0.90           TCP      74     52186→443 [SYN] Seq=0 Win=5840 Len=0 MSS=1460 SACK_PERM=1 TSval=1772414 TSecr=0 WS=32

Frame 58: 74 bytes on wire (592 bits), 74 bytes captured (592 bits) on interface 0
Ethernet II, Src: BrocadeC_c7:65:cc (00:e0:52:c7:65:cc), Dst: Netronix_f2:93:1a (00:e0:7d:f2:93:1a)
Internet Protocol Version 4, Src: 210.200.12.66 (210.200.12.66), Dst: 200.28.0.90 (200.28.0.90)
Transmission Control Protocol, Src Port: 52186 (52186), Dst Port: 443 (443), Seq: 0, Len: 0

No.     Time           Source                Destination           Protocol Length Info
     59 1.161427000    10.10.10.99           200.28.0.90           TCP      74     36130→443 [SYN] Seq=0 Win=5840 Len=0 MSS=1460 SACK_PERM=1 TSval=1772414 TSecr=0 WS=32

Frame 59: 74 bytes on wire (592 bits), 74 bytes captured (592 bits) on interface 0
Ethernet II, Src: Asiarock_15:3d:3a (00:19:66:15:3d:3a), Dst: AsustekC_c2:04:78 (00:26:18:c2:04:78)
Internet Protocol Version 4, Src: 10.10.10.99 (10.10.10.99), Dst: 200.28.0.90 (200.28.0.90)
Transmission Control Protocol, Src Port: 36130 (36130), Dst Port: 443 (443), Seq: 0, Len: 0

No.     Time           Source                Destination           Protocol Length Info
     60 1.161436000    210.200.12.66         200.28.0.90           TCP      74     [TCP Out-Of-Order] 52186→443 [SYN] Seq=0 Win=5840 Len=0 MSS=1460 SACK_PERM=1 TSval=1772414 TSecr=0 WS=32

Frame 60: 74 bytes on wire (592 bits), 74 bytes captured (592 bits) on interface 0
Ethernet II, Src: Netronix_f2:93:1a (00:e0:7d:f2:93:1a), Dst: Netronix_4a:14:20 (00:08:54:4a:14:20)
Internet Protocol Version 4, Src: 210.200.12.66 (210.200.12.66), Dst: 200.28.0.90 (200.28.0.90)
Transmission Control Protocol, Src Port: 52186 (52186), Dst Port: 443 (443), Seq: 0, Len: 0

No.     Time           Source                Destination           Protocol Length Info
     61 1.161519000    210.200.12.66         200.28.0.90           TCP      74     36130→443 [SYN] Seq=0 Win=5840 Len=0 MSS=1460 SACK_PERM=1 TSval=1772414 TSecr=0 WS=32

Frame 61: 74 bytes on wire (592 bits), 74 bytes captured (592 bits) on interface 0
Ethernet II, Src: BrocadeC_c7:65:cc (00:e0:52:c7:65:cc), Dst: Netronix_f2:93:1a (00:e0:7d:f2:93:1a)
Internet Protocol Version 4, Src: 210.200.12.66 (210.200.12.66), Dst: 200.28.0.90 (200.28.0.90)
Transmission Control Protocol, Src Port: 36130 (36130), Dst Port: 443 (443), Seq: 0, Len: 0

No.     Time           Source                Destination           Protocol Length Info
     62 1.161588000    Asiarock_15:3d:1d     Broadcast             ARP      60     Who has 200.28.0.90?  Tell 200.28.0.100

Frame 62: 60 bytes on wire (480 bits), 60 bytes captured (480 bits) on interface 0
Ethernet II, Src: Asiarock_15:3d:1d (00:19:66:15:3d:1d), Dst: Broadcast (ff:ff:ff:ff:ff:ff)
Address Resolution Protocol (request)

No.     Time           Source                Destination           Protocol Length Info
     63 1.161671000    210.200.12.66         200.28.0.90           TCP      74     [TCP Out-Of-Order] 36130→443 [SYN] Seq=0 Win=5840 Len=0 MSS=1460 SACK_PERM=1 TSval=1772414 TSecr=0 WS=32

Frame 63: 74 bytes on wire (592 bits), 74 bytes captured (592 bits) on interface 0
Ethernet II, Src: Netronix_f2:93:1a (00:e0:7d:f2:93:1a), Dst: Netronix_4a:14:20 (00:08:54:4a:14:20)
Internet Protocol Version 4, Src: 210.200.12.66 (210.200.12.66), Dst: 200.28.0.90 (200.28.0.90)
Transmission Control Protocol, Src Port: 36130 (36130), Dst Port: 443 (443), Seq: 0, Len: 0

No.     Time           Source                Destination           Protocol Length Info
     64 1.161753000    Giga-Byt_6d:5f:f3     Asiarock_15:3d:1d     ARP      60     200.28.0.90 is at 90:2b:34:6d:5f:f3

Frame 64: 60 bytes on wire (480 bits), 60 bytes captured (480 bits) on interface 0
Ethernet II, Src: Giga-Byt_6d:5f:f3 (90:2b:34:6d:5f:f3), Dst: Asiarock_15:3d:1d (00:19:66:15:3d:1d)
Address Resolution Protocol (reply)

No.     Time           Source                Destination           Protocol Length Info
     65 1.161857000    210.200.12.66         200.28.0.90           TCP      74     [TCP Out-Of-Order] 52186→443 [SYN] Seq=0 Win=5840 Len=0 MSS=1460 SACK_PERM=1 TSval=1772414 TSecr=0 WS=32

Frame 65: 74 bytes on wire (592 bits), 74 bytes captured (592 bits) on interface 0
Ethernet II, Src: Asiarock_15:3d:1d (00:19:66:15:3d:1d), Dst: Giga-Byt_6d:5f:f3 (90:2b:34:6d:5f:f3)
Internet Protocol Version 4, Src: 210.200.12.66 (210.200.12.66), Dst: 200.28.0.90 (200.28.0.90)
Transmission Control Protocol, Src Port: 52186 (52186), Dst Port: 443 (443), Seq: 0, Len: 0

No.     Time           Source                Destination           Protocol Length Info
     66 1.161937000    210.200.12.66         200.28.0.90           TCP      74     [TCP Out-Of-Order] 36130→443 [SYN] Seq=0 Win=5840 Len=0 MSS=1460 SACK_PERM=1 TSval=1772414 TSecr=0 WS=32

Frame 66: 74 bytes on wire (592 bits), 74 bytes captured (592 bits) on interface 0
Ethernet II, Src: Asiarock_15:3d:1d (00:19:66:15:3d:1d), Dst: Giga-Byt_6d:5f:f3 (90:2b:34:6d:5f:f3)
Internet Protocol Version 4, Src: 210.200.12.66 (210.200.12.66), Dst: 200.28.0.90 (200.28.0.90)
Transmission Control Protocol, Src Port: 36130 (36130), Dst Port: 443 (443), Seq: 0, Len: 0

No.     Time           Source                Destination           Protocol Length Info
     67 1.162110000    200.28.0.90           210.200.12.66         TCP      74     443→52186 [SYN, ACK] Seq=0 Ack=1 Win=14480 Len=0 MSS=1460 SACK_PERM=1 TSval=70145810 TSecr=1772414 WS=64

Frame 67: 74 bytes on wire (592 bits), 74 bytes captured (592 bits) on interface 0
Ethernet II, Src: Giga-Byt_6d:5f:f3 (90:2b:34:6d:5f:f3), Dst: Asiarock_15:3d:1d (00:19:66:15:3d:1d)
Internet Protocol Version 4, Src: 200.28.0.90 (200.28.0.90), Dst: 210.200.12.66 (210.200.12.66)
Transmission Control Protocol, Src Port: 443 (443), Dst Port: 52186 (52186), Seq: 0, Ack: 1, Len: 0

No.     Time           Source                Destination           Protocol Length Info
     68 1.162119000    200.28.0.90           210.200.12.66         TCP      74     443→36130 [SYN, ACK] Seq=0 Ack=1 Win=14480 Len=0 MSS=1460 SACK_PERM=1 TSval=70145810 TSecr=1772414 WS=64

